{
  "nowPlaying": null,
  "recent": [
    {
      "track": "Half Right",
      "artist": "Heatmiser",
      "album": "Mic City Sons",
      "url": "https://www.last.fm/music/Heatmiser/_/Half+Right",
      "playedAt": "2026-10-26T08:53:00Z"
    }
  ],
  "topArtists": [
    {
      "artist": "Heatmiser",
      "plays": 1,
      "url": "https://www.last.fm/music/Heatmiser"
    }
  ],
  "scrobbles": {
    "thisWeek": 1,
    "lastWeek": 0
  }
}
